{"attributes":{"font":{"slug":"apropal","name":"Apropal","download":"static/wk-fonts/Apropal.zip","sets":"CE, WE","desc":"In the old Warsaw’s urban slang, Apropal means a small time crook. This font is inspired by the “Czytelnik” bookstore, the information signs from Warsaw’s Zoo, and designs found in the “Lettering Techniques” book manual, by Jan Wojeński. “Apropal” is a sans-serif display font, ideal for decorative signs, also with a vertical text direction.","styles":[{"name":"Bold","font":"Apropal-Bold"}],"covers":[{"link":"/static/images/font-covers/wk-48.svg","color":"#F9E276"},{"link":"/static/images/font-covers/wk-45.svg","color":"#F9E276"},{"link":"/static/images/font-covers/wk-46.svg","color":"#F9E276"},{"link":"/static/images/font-covers/wk-47.svg","color":"#F9E276"},{"link":"/static/images/font-covers/wk-49.svg","color":"#F9E276"}]},"author":{"name":"Rafał Buchner","photo":"/static/images/authors/rb.jpg","desc":"Graduated from the Graphic Design Dept. on Warsaw Academy of Fine Arts. Type designer for “Tygodnik Powszechny” weekly magazine, “History Meeting House” and others. Cooperated with „Bęc Zmiana” Cultural Foundation, Polish Modern Art Foundation, and “Znak” monthly magazine.","links":[{"link":"https://www.instagram.com/gugutthemonster/","title":"Instagram"}]}},"body":"","frontmatter":"font:\n    slug: apropal\n    name: Apropal\n    download: static/wk-fonts/Apropal.zip\n    sets: CE, WE\n    desc: In the old Warsaw’s urban slang, Apropal means a small time crook. This font is inspired by the “Czytelnik” bookstore, the information signs from Warsaw’s Zoo, and designs found in the “Lettering Techniques” book manual, by Jan Wojeński. “Apropal” is a sans-serif display font, ideal for decorative signs, also with a vertical text direction.\n    styles:\n        -\n            name: Bold\n            font: Apropal-Bold\n    covers:\n        -\n            link: /static/images/font-covers/wk-48.svg\n            color: \"#F9E276\"\n        -\n            link: /static/images/font-covers/wk-45.svg\n            color: \"#F9E276\"\n        -\n            link: /static/images/font-covers/wk-46.svg\n            color: \"#F9E276\"\n        -\n            link: /static/images/font-covers/wk-47.svg\n            color: \"#F9E276\"\n        -\n            link: /static/images/font-covers/wk-49.svg\n            color: \"#F9E276\"\nauthor:\n    name: Rafał Buchner\n    photo: /static/images/authors/rb.jpg\n    desc: Graduated from the Graphic Design Dept. on Warsaw Academy of Fine Arts. Type designer for “Tygodnik Powszechny” weekly magazine, “History Meeting House” and others. Cooperated with „Bęc Zmiana” Cultural Foundation, Polish Modern Art Foundation, and “Znak” monthly magazine.\n    links:\n        -\n            link: https://www.instagram.com/gugutthemonster/\n            title: Instagram"}