{"attributes":{"font":{"slug":"bajaderka","name":"Bajaderka","download":"static/wk-fonts/Bajaderka.zip","sets":"CE, WE","desc":"“Bajaderka” font is inspired by lettering of the small signage tablets found  in Warsaw shops. The letters feature details typical for traditional calligraphy, with visible brush strokes, referring to the charming style of Warsaw’s sign painters.","styles":[{"name":"regular","font":"Bajaderka-Regular"}],"covers":[{"link":"/static/images/font-covers/wk-58.svg","color":"#FDEBE8"},{"link":"/static/images/font-covers/wk-57.svg","color":"#FDEBE8"},{"link":"/static/images/font-covers/wk-56.svg","color":"#FDEBE8"}]},"author":{"name":"Beata Kurek","photo":"/static/images/authors/bk.jpg","desc":"Graduated from the Graphic and Communication Design Dept. on Poznań Fine Arts University. As a LoveLetters Studio, she designs fonts and lettering based on calligraphic writing. She also teaches lettering on workshops. Participant of  “Bękart” and “Jasnowidze” projects.","links":[{"link":"https://www.facebook.com/lovelettersstudiopl","title":"Behance"}]}},"body":"","frontmatter":"font:\n    slug: bajaderka\n    name: Bajaderka\n    download: static/wk-fonts/Bajaderka.zip\n    sets: CE, WE\n    desc: “Bajaderka” font is inspired by lettering of the small signage tablets found  in Warsaw shops. The letters feature details typical for traditional calligraphy, with visible brush strokes, referring to the charming style of Warsaw’s sign painters.\n    styles:\n        -\n            name: regular\n            font: Bajaderka-Regular\n    covers:\n        -\n            link: /static/images/font-covers/wk-58.svg\n            color: \"#FDEBE8\"\n        -\n            link: /static/images/font-covers/wk-57.svg\n            color: \"#FDEBE8\"\n        -\n            link: /static/images/font-covers/wk-56.svg\n            color: \"#FDEBE8\"\nauthor:\n    name: Beata Kurek\n    photo: /static/images/authors/bk.jpg\n    desc: Graduated from the Graphic and Communication Design Dept. on Poznań Fine Arts University. As a LoveLetters Studio, she designs fonts and lettering based on calligraphic writing. She also teaches lettering on workshops. Participant of  “Bękart” and “Jasnowidze” projects.\n    links:\n        -\n            link: https://www.facebook.com/lovelettersstudiopl\n            title: Behance"}