{"attributes":{"fontlistTitle":"Warszawskie Kroje","fonts":[{"slug":"apropal","name":"Apropal","author":"Rafał Buchner","styles":"1 styl","sets":"CE, WE"},{"slug":"bajaderka","name":"Bajaderka","author":"Beata Kurek","styles":"1 styl","sets":"CE, WE"},{"slug":"cyrulik","name":"Cyrulik","author":"Maciej Połczyński","styles":"3 style","sets":"CE, WE"},{"slug":"havana","name":"Havana","author":"Joanna Angulska","styles":"1 styl","sets":"CE, WE"},{"slug":"lombard","name":"Lombard","author":"Ania Wieluńska","styles":"1 styl","sets":"CE, WE"},{"slug":"magiel","name":"Magiel","author":"Mateusz Machalski","styles":"2 style","sets":"CE, WE, SE"},{"slug":"nocturne","name":"Nocturne","author":"Mateusz Machalski","styles":"7 style","sets":"CE, WE, SE, CY"},{"slug":"olympic","name":"Olympic","author":"Ludka Niezgoda","styles":"1 styl","sets":"CE, WE"},{"slug":"praho","name":"Praho","author":"Maciek Włoczewski","styles":"1 styl","sets":"CE, WE"},{"slug":"rewir","name":"Rewir","author":"Robert Jarzec","styles":"1 styl","sets":"CE, WE"},{"slug":"tagger","name":"Tagger","author":"Zuzanna Rogatty","styles":"1 styl","sets":"CE, WE"},{"slug":"zaklad","name":"Zakład","author":"Szymon Sznajder","styles":"1 styl","sets":"CE, WE"}],"moreTitle":"więcej","more":{"about":{"title":"O projekcie","text":"Dowiedz się więcej o tym jak powstawały Warszawskie Kroje, zoabcz zdjęcia z warsztatów i materiały prasowe."},"resources":{"title":"Archiwum","text":"Udostępniamy całą naszą dokumentację i źródła inspiracji – setki zdjęć najciekawszych przykładów warszawskiej typografii, archiwalne projekty neonów i wiele innych."},"store":{"wip":true,"title":"Sklep","text":"Wesprzyj Warszawskie Kroje i spraw sobie ręcznie produkowane typgraficzne gadżety z limitowanej serii."}}},"body":"Warszawskie Kroje to\n[12 nowych krojów pism](/#fontlist)\nstworzonych specjalnie dla Warszawy, w oparciu o lokalne tradycje typograficzne.\n\nWszystkie fonty dostępne są za darmo.\n&#10084;\n","frontmatter":"fontlistTitle: Warszawskie Kroje\nfonts:\n    -\n        slug: apropal\n        name: Apropal\n        author: Rafał Buchner\n        styles: 1 styl\n        sets: CE, WE\n    -\n        slug: bajaderka\n        name: Bajaderka\n        author: Beata Kurek\n        styles: 1 styl\n        sets: CE, WE\n    -\n        slug: cyrulik\n        name: Cyrulik\n        author: Maciej Połczyński\n        styles: 3 style\n        sets: CE, WE\n    -\n        slug: havana\n        name: Havana\n        author: Joanna Angulska\n        styles: 1 styl\n        sets: CE, WE\n    -\n        slug: lombard\n        name: Lombard\n        author: Ania Wieluńska\n        styles: 1 styl\n        sets: CE, WE\n    -\n        slug: magiel\n        name: Magiel\n        author: Mateusz Machalski\n        styles: 2 style\n        sets: CE, WE, SE\n    -\n        slug: nocturne\n        name: Nocturne\n        author: Mateusz Machalski\n        styles: 7 style\n        sets: CE, WE, SE, CY\n    -\n        slug: olympic\n        name: Olympic\n        author: Ludka Niezgoda\n        styles: 1 styl\n        sets: CE, WE\n    -\n        slug: praho\n        name: Praho\n        author: Maciek Włoczewski\n        styles: 1 styl\n        sets: CE, WE\n    -\n        slug: rewir\n        name: Rewir\n        author: Robert Jarzec\n        styles: 1 styl\n        sets: CE, WE\n    -\n        slug: tagger\n        name: Tagger\n        author: Zuzanna Rogatty\n        styles: 1 styl\n        sets: CE, WE\n    -\n        slug: zaklad\n        name: Zakład\n        author: Szymon Sznajder\n        styles: 1 styl\n        sets: CE, WE\n\nmoreTitle: więcej\nmore:\n    about:\n        title: O projekcie\n        text: Dowiedz się więcej o tym jak powstawały Warszawskie Kroje, zoabcz zdjęcia z warsztatów i materiały prasowe.\n    resources:\n        title: Archiwum\n        text: Udostępniamy całą naszą dokumentację i źródła inspiracji – setki zdjęć najciekawszych przykładów warszawskiej typografii, archiwalne projekty neonów i wiele innych.\n    store:\n        wip: true\n        title: Sklep\n        text: Wesprzyj Warszawskie Kroje i spraw sobie ręcznie produkowane typgraficzne gadżety z limitowanej serii."}