{"attributes":{"font":{"slug":"praho","name":"Praho","download":"static/wk-fonts/Praho.zip","sets":"CE, WE","desc":"“Praho” is inspired by large contrasts and narrow shapes, found in fonts used in Warsaw before 1989, specifically on older street and shop signage. The result is an original modern typeface with a strong local vibe.","styles":[{"name":"Black","font":"Praho-Black"}],"covers":[{"link":"/static/images/font-covers/wk-52.svg","color":"#B49D4F"},{"link":"/static/images/font-covers/wk-50.svg","color":"#B49D4F"},{"link":"/static/images/font-covers/wk-51.svg","color":"#B49D4F"}]},"author":{"name":"Maciej Włoczewski","photo":"/static/images/authors/mw.jpg","desc":"Student of the Graphic Design Dept. on Warsaw Academy of Fine Arts. Type designer and a photographer.","links":[{"link":"https://www.behance.net/mwtype","title":"Behance"}]}},"body":"","frontmatter":"font:\n    slug: praho\n    name: Praho\n    download: static/wk-fonts/Praho.zip\n    sets: CE, WE\n    desc: “Praho” is inspired by large contrasts and narrow shapes, found in fonts used in Warsaw before 1989, specifically on older street and shop signage. The result is an original modern typeface with a strong local vibe.\n\n    styles:\n        -\n            name: Black\n            font: Praho-Black\n    covers:\n        -\n            link: /static/images/font-covers/wk-52.svg\n            color: \"#B49D4F\"\n        -\n            link: /static/images/font-covers/wk-50.svg\n            color: \"#B49D4F\"\n        -\n            link: /static/images/font-covers/wk-51.svg\n            color: \"#B49D4F\"\nauthor:\n    name: Maciej Włoczewski\n    photo: /static/images/authors/mw.jpg\n    desc: Student of the Graphic Design Dept. on Warsaw Academy of Fine Arts. Type designer and a photographer.\n    links:\n        -\n            link: https://www.behance.net/mwtype\n            title: Behance"}