{"attributes":{"font":{"slug":"cyrulik","name":"Cyrulik","download":"static/wk-fonts/Cyrulik.zip","sets":"CE, WE, SE","desc":"Inspiracją do powstania projektu był krój „Cyklop”, który był używany w przedwojennej gazecie „Cyrulik Warszawski”. Wersja „stencil” inspirowana jest technicznymi napisami występującymi na różnego rodzaju urządzeniach mechaniczno-elektrycznych w Warszawie. Krój „Cyrulik” łączący mocny i wyrazisty rysunek liter z delikatymi i nowoczesnymi detalami. Całość projektu ma oddawać współczesny klimat i charakter warszawskich ulic.","styles":[{"name":"Sharp","font":"Cyrulik-Sharp"},{"name":"Sharp Bold","font":"Cyrulik-SharpBold"},{"name":"Rounded","font":"Cyrulik-Rounded"},{"name":"Stencil","font":"Cyrulik-Stencil"}],"covers":[{"link":"static/images/font-covers/wk-60.svg","color":"#E54847"},{"link":"static/images/font-covers/wk-59.svg","color":"#E54847"},{"link":"static/images/font-covers/wk-61.svg","color":"#E54847"}]},"author":{"name":"Maciej Połczyński","photo":"static/images/authors/mp.jpg","desc":"Absolwent wydziału Sztuki Nowych Mediów w Polsko-Japońskiej Akademii Technik Komputerowych w Warszawie. Zajmuję się projektowanie krojów pisma, brandingiem i animacją. Stypendysta Type Directors Club.","links":[{"link":"https://www.behance.net/krzyweto","title":"Behance"}]}},"body":"","frontmatter":"font:\n    slug: cyrulik\n    name: Cyrulik\n    download: static/wk-fonts/Cyrulik.zip\n    sets: CE, WE, SE\n    desc: Inspiracją do powstania projektu był krój „Cyklop”, który był używany w przedwojennej gazecie „Cyrulik Warszawski”. Wersja „stencil” inspirowana jest technicznymi napisami występującymi na różnego rodzaju urządzeniach mechaniczno-elektrycznych w Warszawie. Krój „Cyrulik” łączący mocny i wyrazisty rysunek liter z delikatymi i nowoczesnymi detalami. Całość projektu ma oddawać współczesny klimat i charakter warszawskich ulic.\n    styles:\n        -\n            name: Sharp\n            font: Cyrulik-Sharp\n        -\n            name: Sharp Bold\n            font: Cyrulik-SharpBold\n        -\n            name: Rounded\n            font: Cyrulik-Rounded\n        -\n            name: Stencil\n            font: Cyrulik-Stencil\n    covers:\n        -\n            link: static/images/font-covers/wk-60.svg\n            color: \"#E54847\"\n        -\n            link: static/images/font-covers/wk-59.svg\n            color: \"#E54847\"\n        -\n            link: static/images/font-covers/wk-61.svg\n            color: \"#E54847\"\n\nauthor:\n    name: Maciej Połczyński\n    photo: static/images/authors/mp.jpg\n    desc: Absolwent wydziału Sztuki Nowych Mediów w Polsko-Japońskiej Akademii Technik Komputerowych w Warszawie. Zajmuję się projektowanie krojów pisma, brandingiem i animacją. Stypendysta Type Directors Club.\n    links:\n        -\n            link: https://www.behance.net/krzyweto\n            title: Behance"}