{"attributes":{"font":{"slug":"tagger","name":"Tagger","download":"static/wk-fonts/Tagger.zip","sets":"CE, WE, SE","desc":"“Tagger” is inspired by Warsaw’s graffiti tags. It’s a modern script font with a dynamic character and casual forms. Tagger is a perfect fit for visual identity of bars, restaurants, shops. It can also be used for menus, price tags, labels and announcements.","styles":[{"name":"Regular","font":"Tagger-Regular"}],"covers":[{"link":"/static/images/font-covers/wk-31.svg","color":"#474A58"},{"link":"/static/images/font-covers/wk-29.svg","color":"#474A58"},{"link":"/static/images/font-covers/wk-30.svg","color":"#474A58"},{"link":"/static/images/font-covers/wk-31.svg","color":"#474A58"}]},"author":{"name":"Zuzanna Rogatty","photo":"/static/images/authors/zr.jpg","desc":"Graphic designer specialising in visual identity, lettering and typography. Graduated from the Graphic and Communication Design Dept. on Poznań Fine Arts University. Designer at Mamastudio. She is the author of the visual identity for Two Shores Festival, FAMA Festival, and others. Rogatty’s work was featured on several exhibitions such as: „Places of Origin: Polish Graphic Design in Context”, “Polish Logo Design Exhibition” and “Typopolo”.","links":[{"link":"www.rogatty.com","title":"Portfolio"}]}},"body":"","frontmatter":"font:\n    slug: tagger\n    name: Tagger\n    download: static/wk-fonts/Tagger.zip\n    sets: CE, WE, SE\n    desc: “Tagger” is inspired by Warsaw’s graffiti tags. It’s a modern script font with a dynamic character and casual forms. Tagger is a perfect fit for visual identity of bars, restaurants, shops. It can also be used for menus, price tags, labels and announcements.\n\n\n\n    styles:\n        -\n            name: Regular\n            font: Tagger-Regular\n    covers:\n        -\n            link: /static/images/font-covers/wk-31.svg\n            color: \"#474A58\"\n        -\n            link: /static/images/font-covers/wk-29.svg\n            color: \"#474A58\"\n        -\n            link: /static/images/font-covers/wk-30.svg\n            color: \"#474A58\"\n        -\n            link: /static/images/font-covers/wk-31.svg\n            color: \"#474A58\"\n\nauthor:\n    name: Zuzanna Rogatty\n    photo: /static/images/authors/zr.jpg\n    desc: 'Graphic designer specialising in visual identity, lettering and typography. Graduated from the Graphic and Communication Design Dept. on Poznań Fine Arts University. Designer at Mamastudio. She is the author of the visual identity for Two Shores Festival, FAMA Festival, and others. Rogatty’s work was featured on several exhibitions such as: „Places of Origin: Polish Graphic Design in Context”, “Polish Logo Design Exhibition” and “Typopolo”.'\n\n    links:\n        -\n            link: www.rogatty.com\n            title: Portfolio"}