{"attributes":{"font":{"slug":"olympic","name":"Olympic","download":"static/wk-fonts/Olympic.zip","sets":"CE, WE, SE","desc":"„Olympic” to elegancki krój do zastosowań display’owych. Projekt był inspirowany warszawskimi szyldami oraz stołeczną typografią lat 70-tych. Font, mimo uniwersalności i nowoczesności, zwiera w swojej formie rodzaj nostalgii za dawną Warszawą.","styles":[{"name":"Light","font":"Olympic-Light"}],"covers":[{"link":"static/images/font-covers/wk-38.svg","color":"#E2E8E9"},{"link":"static/images/font-covers/wk-39.svg","color":"#E2E8E9"},{"link":"static/images/font-covers/wk-40.svg","color":"#E2E8E9"}]},"author":{"name":"Ludka Niezgoda","photo":"static/images/authors/ln.jpg","desc":"Studentka Akademii Sztuk Pięknych w Warszawie. Stypendystka Krajowego Funduszu na rzecz Dzieci. Zajmuje się głównie typografią i projektowaniem krojów pism.","links":[{"link":"https://www.behance.net/nieludka","title":"Behance"}]}},"body":"","frontmatter":"font:\n    slug: olympic\n    name: Olympic\n    download: static/wk-fonts/Olympic.zip\n    sets: CE, WE, SE\n    desc: „Olympic” to elegancki krój do zastosowań display’owych. Projekt był inspirowany warszawskimi szyldami oraz stołeczną typografią lat 70-tych. Font, mimo uniwersalności i nowoczesności, zwiera w swojej formie rodzaj nostalgii za dawną Warszawą.\n\n    styles:\n        -\n            name: Light\n            font: Olympic-Light\n    covers:\n        -\n            link: static/images/font-covers/wk-38.svg\n            color: \"#E2E8E9\"\n        -\n            link: static/images/font-covers/wk-39.svg\n            color: \"#E2E8E9\"\n        -\n            link: static/images/font-covers/wk-40.svg\n            color: \"#E2E8E9\"\nauthor:\n    name: Ludka Niezgoda\n    photo: static/images/authors/ln.jpg\n    desc: Studentka Akademii Sztuk Pięknych w Warszawie. Stypendystka Krajowego Funduszu na rzecz Dzieci. Zajmuje się głównie typografią i projektowaniem krojów pism.\n    links:\n        -\n            link: https://www.behance.net/nieludka\n            title: Behance"}