{"attributes":{"font":{"slug":"bajaderka","name":"Bajaderka","download":"static/wk-fonts/Bajaderka.zip","sets":"CE, WE","desc":"Krój „Bajaderka” inspirowany jest typografią tabliczek warszawskich zakładów usługowych. Formy liter to połączenie kształtów pisma charakterystycznego dla tradycyjnej kaligrafii i narzędziowego detalu. Projekt zwiera w sobie urok odręcznego pisma literników i warszawskich szyldziarzy.","styles":[{"name":"regular","font":"Bajaderka-Regular"}],"covers":[{"link":"static/images/font-covers/wk-58.svg","color":"#FDEBE8"},{"link":"static/images/font-covers/wk-57.svg","color":"#FDEBE8"},{"link":"static/images/font-covers/wk-56.svg","color":"#FDEBE8"}]},"author":{"name":"Beata Kurek","photo":"static/images/authors/bk.jpg","desc":"Absolwentka Wydziału Grafiki i Komunikacji Wizualnej na Uniwersytecie Artystycznym w Poznaniu. Jako LoveLetters Studio zajmuje się projektowaniem liternictwa opartego na kaligrafii i piśmie odręcznym oraz prowadzeniem warsztatów literniczych. Uczestniczka projektów „Bękart” oraz „Jasnowidze”.","links":[{"link":"https://www.facebook.com/lovelettersstudiopl","title":"Behance"}]}},"body":"","frontmatter":"font:\n    slug: bajaderka\n    name: Bajaderka\n    download: static/wk-fonts/Bajaderka.zip\n    sets: CE, WE\n    desc: Krój „Bajaderka” inspirowany jest typografią tabliczek warszawskich zakładów usługowych. Formy liter to połączenie kształtów pisma charakterystycznego dla tradycyjnej kaligrafii i narzędziowego detalu. Projekt zwiera w sobie urok odręcznego pisma literników i warszawskich szyldziarzy.\n    styles:\n        -\n            name: regular\n            font: Bajaderka-Regular\n    covers:\n        -\n            link: static/images/font-covers/wk-58.svg\n            color: \"#FDEBE8\"\n        -\n            link: static/images/font-covers/wk-57.svg\n            color: \"#FDEBE8\"\n        -\n            link: static/images/font-covers/wk-56.svg\n            color: \"#FDEBE8\"\nauthor:\n    name: Beata Kurek\n    photo: static/images/authors/bk.jpg\n    desc: Absolwentka Wydziału Grafiki i Komunikacji Wizualnej na Uniwersytecie Artystycznym w Poznaniu. Jako LoveLetters Studio zajmuje się projektowaniem liternictwa opartego na kaligrafii i piśmie odręcznym oraz prowadzeniem warsztatów literniczych. Uczestniczka projektów „Bękart” oraz „Jasnowidze”.\n    links:\n        -\n            link: https://www.facebook.com/lovelettersstudiopl\n            title: Behance"}