{"attributes":{"font":{"slug":"olympic","name":"Olympic","download":"static/wk-fonts/Olympic.zip","sets":"CE, WE, SE","desc":"„Olympic” is an elegant display font. The design is inspired by Warsaw’s signage and typography from the 70’s. This font is modern and universal, but with a dash nostalgia for the Warsaw’s style of the past.","styles":[{"name":"Light","font":"Olympic-Light"}],"covers":[{"link":"/static/images/font-covers/wk-38.svg","color":"#E2E8E9"},{"link":"/static/images/font-covers/wk-39.svg","color":"#E2E8E9"},{"link":"/static/images/font-covers/wk-40.svg","color":"#E2E8E9"}]},"author":{"name":"Ludka Niezgoda","photo":"/static/images/authors/ln.jpg","desc":"Student of the Graphic Design Dept. on Warsaw Academy of Fine Arts.  Scholar of the National Children’s Fund. She is a lettering and type designer.","links":[{"link":"https://www.behance.net/nieludka","title":"Behance"}]}},"body":"","frontmatter":"font:\n    slug: olympic\n    name: Olympic\n    download: static/wk-fonts/Olympic.zip\n    sets: CE, WE, SE\n    desc: „Olympic” is an elegant display font. The design is inspired by Warsaw’s signage and typography from the 70’s. This font is modern and universal, but with a dash nostalgia for the Warsaw’s style of the past.\n\n    styles:\n        -\n            name: Light\n            font: Olympic-Light\n    covers:\n        -\n            link: /static/images/font-covers/wk-38.svg\n            color: \"#E2E8E9\"\n        -\n            link: /static/images/font-covers/wk-39.svg\n            color: \"#E2E8E9\"\n        -\n            link: /static/images/font-covers/wk-40.svg\n            color: \"#E2E8E9\"\nauthor:\n    name: Ludka Niezgoda\n    photo: /static/images/authors/ln.jpg\n    desc: Student of the Graphic Design Dept. on Warsaw Academy of Fine Arts.  Scholar of the National Children’s Fund. She is a lettering and type designer.\n    links:\n        -\n            link: https://www.behance.net/nieludka\n            title: Behance"}