{"attributes":{"font":{"slug":"magiel","name":"Magiel","download":"static/wk-fonts/Magiel.zip","sets":"CE, WE, SE","desc":"„Magiel” to geometryczny display’owy krój pisma inspirowany amatorskim napisami z czasów PRL-u. Projekty liter zawierają w sobie różnorodne „błędy” pochodzące z szyldów, tabliczek i plakatów, które powstały w okresie 1945-1989 w Warszawie.","styles":[{"name":"Black","font":"Magiel-Black"}],"covers":[{"link":"/static/images/font-covers/wk-64.svg","color":"#522D84"},{"link":"/static/images/font-covers/wk-63.svg","color":"#522D84"},{"link":"/static/images/font-covers/wk-62.svg","color":"#522D84"},{"link":"/static/images/font-covers/wk-65.svg","color":"#522D84"}]},"author":{"name":"Mateusz Machalski","photo":"/static/images/authors/mm.jpg","desc":"Absolwent Wydziału Grafiki Akademi Sztuk Pięknych w Warszawie. Zajmuje się projektowaniem identyfikacji wizualnych oraz krojów pism. Autor m.in. identyfikacji wizualnej Nagrody Solidarności im. Lecha Wałęsy oraz projektu rodziny 42 odmian krojów pism dla korporacji Tupperware. Dyrektor artystyczny magazynu „Warsawholic”.","links":[{"link":"http://www.machalski.wtf","title":"Behance"}]}},"body":"","frontmatter":"font:\n    slug: magiel\n    name: Magiel\n    download: static/wk-fonts/Magiel.zip\n    sets: CE, WE, SE\n    desc: „Magiel” to geometryczny display’owy krój pisma inspirowany amatorskim napisami z czasów PRL-u. Projekty liter zawierają w sobie różnorodne „błędy” pochodzące z szyldów, tabliczek i plakatów, które powstały w okresie 1945-1989 w Warszawie.\n\n    styles:\n        -\n            name: Black\n            font: Magiel-Black\n    covers:\n        -\n            link: /static/images/font-covers/wk-64.svg\n            color: \"#522D84\"\n        -\n            link: /static/images/font-covers/wk-63.svg\n            color: \"#522D84\"\n        -\n            link: /static/images/font-covers/wk-62.svg\n            color: \"#522D84\"\n        -\n            link: /static/images/font-covers/wk-65.svg\n            color: \"#522D84\"\nauthor:\n    name: Mateusz Machalski\n    photo: /static/images/authors/mm.jpg\n    desc: Absolwent Wydziału Grafiki Akademi Sztuk Pięknych w Warszawie. Zajmuje się projektowaniem identyfikacji wizualnych oraz krojów pism. Autor m.in. identyfikacji wizualnej Nagrody Solidarności im. Lecha Wałęsy oraz projektu rodziny 42 odmian krojów pism dla korporacji Tupperware. Dyrektor artystyczny magazynu „Warsawholic”.\n\n    links:\n        -\n            link: http://www.machalski.wtf\n            title: Behance"}