{"attributes":{"font":{"slug":"zaklad","name":"Zakład","download":"static/wk-fonts/Zaklad.zip","sets":"CE, WE","desc":"„Zakład” to displayowy krój pisma zaprojektowany w taki sposób, aby sprawdzał się na szyldach, jak i plakatach opisujących różne wydarzenia kulturalne w Warszawie. Jego masywna konstrukcja oraz zdecydowany i odważny rysunek, inspirowany liternictwem z szyldów zakładów rzemieślniczych, sprawia że jest on w swej formie wizualnej charakterystyczny i zauważalny.","styles":[{"name":"Regular","font":"Zaklad-Regular"}],"covers":[{"link":"static/images/font-covers/wk-42.svg","color":"#E2E8E9"},{"link":"static/images/font-covers/wk-42.svg","color":"#E2E8E9"},{"link":"static/images/font-covers/wk-43.svg","color":"#E2E8E9"},{"link":"static/images/font-covers/wk-44.svg","color":"#E2E8E9"}]},"author":{"name":"Szymon Sznajder","photo":"static/images/authors/ss.jpg","desc":"Ukończył Uniwersytet Artystyczny w Poznaniu broniąc dyplomy licencjacki i magisterski z projektowania krojów pism. Laureat licznych wyróżnień i nagród. Między innymi obydwa dyplomy zostały zakwalifikowane do Przeglądu Projektów Dyplomowych Graduation Projects, a za dyplom magisterski został laureatem stypendium im. Marii Dokowicz. Obecnie aktywnie projektuje liczne zlecenia komercyjne oraz wykłada na Uniwersytecie Artystycznym w Poznaniu.","links":[{"link":"www.typolis.pl","title":"Portfolio"}]}},"body":"","frontmatter":"font:\n    slug: zaklad\n    name: Zakład\n    download: static/wk-fonts/Zaklad.zip\n    sets: CE, WE\n    desc: „Zakład” to displayowy krój pisma zaprojektowany w taki sposób, aby sprawdzał się na szyldach, jak i plakatach opisujących różne wydarzenia kulturalne w Warszawie. Jego masywna konstrukcja oraz zdecydowany i odważny rysunek, inspirowany liternictwem z szyldów zakładów rzemieślniczych, sprawia że jest on w swej formie wizualnej charakterystyczny i zauważalny.\n\n    styles:\n        -\n            name: Regular\n            font: Zaklad-Regular\n    covers:\n        -\n            link: static/images/font-covers/wk-42.svg\n            color: \"#E2E8E9\"\n        -\n            link: static/images/font-covers/wk-42.svg\n            color: \"#E2E8E9\"\n        -\n            link: static/images/font-covers/wk-43.svg\n            color: \"#E2E8E9\"\n        -\n            link: static/images/font-covers/wk-44.svg\n            color: \"#E2E8E9\"\nauthor:\n    name: Szymon Sznajder\n    photo: static/images/authors/ss.jpg\n    desc: Ukończył Uniwersytet Artystyczny w Poznaniu broniąc dyplomy licencjacki i magisterski z projektowania krojów pism. Laureat licznych wyróżnień i nagród. Między innymi obydwa dyplomy zostały zakwalifikowane do Przeglądu Projektów Dyplomowych Graduation Projects, a za dyplom magisterski został laureatem stypendium im. Marii Dokowicz. Obecnie aktywnie projektuje liczne zlecenia komercyjne oraz wykłada na Uniwersytecie Artystycznym w Poznaniu.\n    links:\n        -\n            link: www.typolis.pl\n            title: Portfolio"}