{"attributes":{"font":{"slug":"havana","name":"Havana","download":"static/wk-fonts/Havana.zip","sets":"CE, WE","desc":"“Havana” font i inspired by Warsaw neon signs from before 1989. Just like the lettering of that period, the “Havava” design is detail oriented, coherent and sophisticated. Some letters are directly drawn from specific signs – letters “K” and “m” from “Kosmetyki” or letter “t”  from “Mister” sign. The font’s name itself refers to a former cafe “Havana” in Warsaw.","styles":[{"name":"Regular","font":"Havana-Regular"}],"covers":[{"link":"/static/images/font-covers/wk-33.svg","color":"#474A58"},{"link":"/static/images/font-covers/wk-32.svg","color":"#474A58"},{"link":"/static/images/font-covers/wk-34.svg","color":"#474A58"}]},"author":{"name":"Joanna Angulska","photo":"/static/images/authors/ja.jpg","desc":"Graduated from the Graphic and Communication Design Dept. on Poznań Fine Arts University. Specializes in logo, layout and branding design. Participant and a speaker in “Plaster” and “Typolub” conferences.","links":[{"link":"https://www.behance.net/JoannaAngulska","title":"Behance"}]}},"body":"","frontmatter":"font:\n    slug: havana\n    name: Havana\n    download: static/wk-fonts/Havana.zip\n    sets: CE, WE\n    desc: “Havana” font i inspired by Warsaw neon signs from before 1989. Just like the lettering of that period, the “Havava” design is detail oriented, coherent and sophisticated. Some letters are directly drawn from specific signs – letters “K” and “m” from “Kosmetyki” or letter “t”  from “Mister” sign. The font’s name itself refers to a former cafe “Havana” in Warsaw.\n    styles:\n        -\n            name: Regular\n            font: Havana-Regular\n    covers:\n        -\n            link: /static/images/font-covers/wk-33.svg\n            color: \"#474A58\"\n        -\n            link: /static/images/font-covers/wk-32.svg\n            color: \"#474A58\"\n        -\n            link: /static/images/font-covers/wk-34.svg\n            color: \"#474A58\"\nauthor:\n    name: Joanna Angulska\n    photo: /static/images/authors/ja.jpg\n    desc: Graduated from the Graphic and Communication Design Dept. on Poznań Fine Arts University. Specializes in logo, layout and branding design. Participant and a speaker in “Plaster” and “Typolub” conferences.\n\n    links:\n        -\n            link: https://www.behance.net/JoannaAngulska\n            title: Behance"}