{"attributes":{"font":{"slug":"rewir","name":"Rewir","download":"static/wk-fonts/Rewir.zip","sets":"CE, WE","desc":"„Rewir” is a way-finding font. The letter shapes are inspired by a small sign found on the backyard of a tenement house in Warsaw. The project is a proposal for corpote font to be used on plates and signage on official city and state buildings. The font is very legible, also in the varying viewing conditions. It can be used for official plates, letterheads, public transit information, etc. The design combines the history of Warsaw’s lettering and the requirements of a modern city.","styles":[{"name":"Light","font":"Rewir-Light"}],"covers":[{"link":"/static/images/font-covers/wk-55.svg","color":"#E54847"},{"link":"/static/images/font-covers/wk-54.svg","color":"#E54847"},{"link":"/static/images/font-covers/wk-55.svg","color":"#E54847"}]},"author":{"name":"Robert Jarzec","photo":"/static/images/authors/rj.jpg","desc":"Type, lettering, information architecture and user experience designer. Graduated from the Letter Design Workshop on Poznań Fine Arts University and Cultural Studies on Adam Mickiewicz University. Currently teaching on Poznań Fine Arts University.","links":[{"link":"https://www.behance.net/robertjarzec","title":"Behance"}]}},"body":"","frontmatter":"font:\n    slug: rewir\n    name: Rewir\n    download: static/wk-fonts/Rewir.zip\n    sets: CE, WE\n    desc: „Rewir” is a way-finding font. The letter shapes are inspired by a small sign found on the backyard of a tenement house in Warsaw. The project is a proposal for corpote font to be used on plates and signage on official city and state buildings. The font is very legible, also in the varying viewing conditions. It can be used for official plates, letterheads, public transit information, etc. The design combines the history of Warsaw’s lettering and the requirements of a modern city.\n\n    styles:\n        -\n            name: Light\n            font: Rewir-Light\n    covers:\n        -\n            link: /static/images/font-covers/wk-55.svg\n            color: \"#E54847\"\n        -\n            link: /static/images/font-covers/wk-54.svg\n            color: \"#E54847\"\n        -\n            link: /static/images/font-covers/wk-55.svg\n            color: \"#E54847\"\nauthor:\n    name: Robert Jarzec\n    photo: /static/images/authors/rj.jpg\n    desc: Type, lettering, information architecture and user experience designer. Graduated from the Letter Design Workshop on Poznań Fine Arts University and Cultural Studies on Adam Mickiewicz University. Currently teaching on Poznań Fine Arts University.\n\n    links:\n        -\n            link: https://www.behance.net/robertjarzec\n            title: Behance"}