{"attributes":{"fontlistTitle":"Warsaw Types","fonts":[{"slug":"apropal","name":"Apropal","author":"Rafał Buchner","styles":"1 style","sets":"CE, WE"},{"slug":"bajaderka","name":"Bajaderka","author":"Beata Kurek","styles":"1 style","sets":"CE, WE"},{"slug":"cyrulik","name":"Cyrulik","author":"Maciej Połczyński","styles":"3 styles","sets":"CE, WE"},{"slug":"havana","name":"Havana","author":"Joanna Angulska","styles":"1 style","sets":"CE, WE"},{"slug":"lombard","name":"Lombard","author":"Ania Wieluńska","styles":"1 style","sets":"CE, WE"},{"slug":"magiel","name":"Magiel","author":"Mateusz Machalski","styles":"2 styles","sets":"CE, WE, SE"},{"slug":"nocturne","name":"Nocturne","author":"Mateusz Machalski","styles":"7 styles","sets":"CE, WE, SE, CY"},{"slug":"olympic","name":"Olympic","author":"Ludka Niezgoda","styles":"1 style","sets":"CE, WE"},{"slug":"praho","name":"Praho","author":"Maciek Włoczewski","styles":1,"sets":"CE, WE"},{"slug":"rewir","name":"Rewir","author":"Robert Jarzec","styles":"1 style","sets":"CE, WE"},{"slug":"tagger","name":"Tagger","author":"Zuzanna Rogatty","styles":"1 style","sets":"CE, WE"},{"slug":"zaklad","name":"Zakład","author":"Szymon Sznajder","styles":"1 style","sets":"CE, WE"}],"moreTitle":"more","more":{"about":{"title":"About Warsaw Types","text":"Learn more about the idea and the process of Warsaw Types, see footage from the workshops, and check out the media coverage.\n"},"resources":{"title":"Resources","text":"Learn more about the idea and the process of Warsaw Types, see footage from the workshops, and check out the media coverage.\n"},"store":{"wip":true,"title":"Store","text":"Support Warsaw Types and get yourself some fresh, handmade typographic products from limitted edition.\n"}}},"body":"Warsaw Types is a collection of\n**12 new font families**\ninspired by the Warsaw’s local typographic heritage. They are all available for free.\n\nEnjoy!\n&#10084;\n","frontmatter":"fontlistTitle: Warsaw Types\nfonts:\n    -\n        slug: apropal\n        name: Apropal\n        author: Rafał Buchner\n        styles: 1 style\n        sets: CE, WE\n    -\n        slug: bajaderka\n        name: Bajaderka\n        author: Beata Kurek\n        styles: 1 style\n        sets: CE, WE\n    -\n        slug: cyrulik\n        name: Cyrulik\n        author: Maciej Połczyński\n        styles: 3 styles\n        sets: CE, WE\n    -\n        slug: havana\n        name: Havana\n        author: Joanna Angulska\n        styles: 1 style\n        sets: CE, WE\n    -\n        slug: lombard\n        name: Lombard\n        author: Ania Wieluńska\n        styles: 1 style\n        sets: CE, WE\n    -\n        slug: magiel\n        name: Magiel\n        author: Mateusz Machalski\n        styles: 2 styles\n        sets: CE, WE, SE\n    -\n        slug: nocturne\n        name: Nocturne\n        author: Mateusz Machalski\n        styles: 7 styles\n        sets: CE, WE, SE, CY\n    -\n        slug: olympic\n        name: Olympic\n        author: Ludka Niezgoda\n        styles: 1 style\n        sets: CE, WE\n    -\n        slug: praho\n        name: Praho\n        author: Maciek Włoczewski\n        styles: 1\n        sets: CE, WE\n    -\n        slug: rewir\n        name: Rewir\n        author: Robert Jarzec\n        styles: 1 style\n        sets: CE, WE\n    -\n        slug: tagger\n        name: Tagger\n        author: Zuzanna Rogatty\n        styles: 1 style\n        sets: CE, WE\n    -\n        slug: zaklad\n        name: Zakład\n        author: Szymon Sznajder\n        styles: 1 style\n        sets: CE, WE\n\nmoreTitle: more\nmore:\n    about:\n        title: About Warsaw Types\n        text: >\n            Learn more about the idea and the process of Warsaw Types, see footage from the workshops, and check out the media coverage.\n    resources:\n        title: Resources\n        text: >\n            Learn more about the idea and the process of Warsaw Types, see footage from the workshops, and check out the media coverage.\n    store:\n        wip: true\n        title: Store\n        text: >\n            Support Warsaw Types and get yourself some fresh, handmade typographic products from limitted edition."}